<?xml version="1.0" encoding="UTF-8"?>
<xsd:schema xmlns:xsd="http://www.w3.org/2001/XMLSchema" xmlns:od="urn:schemas-microsoft-com:officedata">
<xsd:element name="dataroot">
<xsd:complexType>
<xsd:sequence>
<xsd:element ref="_x0038_2_AgentPersonMap" minOccurs="0" maxOccurs="unbounded"/>
</xsd:sequence>
<xsd:attribute name="generated" type="xsd:dateTime"/>
</xsd:complexType>
</xsd:element>
<xsd:element name="_x0038_2_AgentPersonMap">
<xsd:annotation>
<xsd:appinfo>
<od:index index-name="AuthorGroupID" index-key="AgentPersonMapID " primary="no" unique="no" clustered="no" order="asc"/>
<od:index index-name="PrimaryKey" index-key="AgentPersonMapID " primary="yes" unique="yes" clustered="no" order="asc"/>
<od:tableProperty name="Orientation" type="2" value="0"/>
<od:tableProperty name="OrderByOn" type="1" value="0"/>
<od:tableProperty name="NameMap" type="11" value="CswOVQAAAACJ3fwt/zE6QrzPRkMG41XaAAAAAFRB4x2VYOZAAAAAAAAAAAA4ADIA
XwBBAGcAZQBuAHQAUABlAHIAcwBvAG4ATQBhAHAAMQAAAAAAAACTN2UgJWOeR6RS
DbSqw9otBwAAAInd/C3/MTpCvM9GQwbjVdpBAGcAZQBuAHQAUABlAHIAcwBvAG4A
TQBhAHAASQBEAAAAAAAAAPDbO3kGcQ1EgDUTVQ0/6soAAAAAi2Y9Hc9a5kAAAAAA
AAAAADgAMQBfAEEAZwBlAG4AdABzAAAAAAAAALc6MaUUoU9Fl/vo3BqPpSUHAAAA
8Ns7eQZxDUSANRNVDT/qykEAZwBlAG4AdABJAEQAAAAAAAAARd/lm3GFxk+A2TV9
8ImbKQcAAADw2zt5BnENRIA1E1UNP+rKQQBnAGUAbgB0AE4AYQBtAGUAAAAAAAAA
/tO3A6qSxEm7+enqIueU5AcAAACJ3fwt/zE6QrzPRkMG41XaQQBnAGUAbgB0AAAA
AAAAAARMfgH6G6VGr/175LECqK0AAAAAf0I8Hc9a5kAAAAAAAAAAADgAMABfAFAA
ZQByAHMAbwBuAHMAAAAAAAAA22+mLr8tv0uE+Q5X0b2R/gcAAAAETH4B+hulRq/9
e+SxAqitUABlAHIAcwBvAG4ASQBEAAAAAAAAAOjdgGH5MI5KiepqJ2vKSYMHAAAA
BEx+AfobpUav/XvksQKorVAAZQByAHMAbwBuAE4AYQBtAGUAAAAAAAAAWFVVvUeP
nE6+NOebGEBUggcAAACJ3fwt/zE6QrzPRkMG41XaUABlAHIAcwBvAG4AAAAAAAAA
AAAAAAAAAAAAAAAAAAAAAAwAAAAFAAAAAAAAAAAAAAAAAAAAAAA=
"/>
<od:tableProperty name="DefaultView" type="2" value="2"/>
<od:tableProperty name="DisplayViewsOnSharePointSite" type="2" value="1"/>
<od:tableProperty name="TotalsRow" type="1" value="0"/>
<od:tableProperty name="FilterOnLoad" type="1" value="0"/>
<od:tableProperty name="OrderByOnLoad" type="1" value="1"/>
<od:tableProperty name="HideNewField" type="1" value="0"/>
<od:tableProperty name="BackTint" type="6" value="100"/>
<od:tableProperty name="BackShade" type="6" value="100"/>
<od:tableProperty name="ThemeFontIndex" type="4" value="1"/>
<od:tableProperty name="AlternateBackThemeColorIndex" type="4" value="1"/>
<od:tableProperty name="AlternateBackTint" type="6" value="100"/>
<od:tableProperty name="AlternateBackShade" type="6" value="95"/>
<od:tableProperty name="ReadOnlyWhenDisconnected" type="1" value="0"/>
<od:tableProperty name="DatasheetGridlinesThemeColorIndex" type="4" value="3"/>
<od:tableProperty name="DatasheetForeThemeColorIndex" type="4" value="0"/>
<od:tableProperty name="PublishToWeb" type="2" value="1"/>
<od:tableProperty name="GUID" type="9" value="id38Lf8xOkK8z0ZDBuNV2g==
"/>
</xsd:appinfo>
</xsd:annotation>
<xsd:complexType>
<xsd:sequence>
<xsd:element name="AgentPersonMapID" minOccurs="1" od:jetType="autonumber" od:sqlSType="int" od:autoUnique="yes" od:nonNullable="yes" type="xsd:int">
<xsd:annotation>
<xsd:appinfo>
<od:fieldProperty name="ColumnWidth" type="3" value="2235"/>
<od:fieldProperty name="ColumnOrder" type="3" value="0"/>
<od:fieldProperty name="ColumnHidden" type="1" value="0"/>
<od:fieldProperty name="TextAlign" type="2" value="0"/>
<od:fieldProperty name="AggregateType" type="4" value="-1"/>
<od:fieldProperty name="ResultType" type="2" value="0"/>
<od:fieldProperty name="CurrencyLCID" type="4" value="0"/>
<od:fieldProperty name="GUID" type="9" value="kzdlICVjnkekUg20qsPaLQ==
"/>
</xsd:appinfo>
</xsd:annotation>
</xsd:element>
<xsd:element name="Agent" minOccurs="0" od:jetType="longinteger" od:sqlSType="int" type="xsd:int">
<xsd:annotation>
<xsd:appinfo>
<od:fieldProperty name="ColumnWidth" type="3" value="4095"/>
<od:fieldProperty name="ColumnOrder" type="3" value="0"/>
<od:fieldProperty name="ColumnHidden" type="1" value="0"/>
<od:fieldProperty name="DecimalPlaces" type="2" value="255"/>
<od:fieldProperty name="Required" type="1" value="0"/>
<od:fieldProperty name="DisplayControl" type="3" value="111"/>
<od:fieldProperty name="RowSourceType" type="10" value="Table/Query"/>
<od:fieldProperty name="RowSource" type="12" value="SELECT [81_Agents].[AgentID], [81_Agents].[AgentName] FROM 81_Agents ORDER BY [AgentName]; "/>
<od:fieldProperty name="BoundColumn" type="3" value="1"/>
<od:fieldProperty name="ColumnCount" type="3" value="2"/>
<od:fieldProperty name="ColumnHeads" type="1" value="0"/>
<od:fieldProperty name="ColumnWidths" type="10" value="0;1440"/>
<od:fieldProperty name="ListRows" type="3" value="16"/>
<od:fieldProperty name="ListWidth" type="10" value="1440twip"/>
<od:fieldProperty name="LimitToList" type="1" value="1"/>
<od:fieldProperty name="AllowMultipleValues" type="1" value="0"/>
<od:fieldProperty name="TextAlign" type="2" value="0"/>
<od:fieldProperty name="AllowValueListEdits" type="1" value="1"/>
<od:fieldProperty name="AggregateType" type="4" value="-1"/>
<od:fieldProperty name="ShowOnlyRowSourceValues" type="1" value="0"/>
<od:fieldProperty name="ResultType" type="2" value="0"/>
<od:fieldProperty name="CurrencyLCID" type="4" value="0"/>
<od:fieldProperty name="GUID" type="9" value="/tO3A6qSxEm7+enqIueU5A==
"/>
</xsd:appinfo>
</xsd:annotation>
</xsd:element>
<xsd:element name="Person" minOccurs="0" od:jetType="longinteger" od:sqlSType="int" type="xsd:int">
<xsd:annotation>
<xsd:appinfo>
<od:fieldProperty name="ColumnWidth" type="3" value="2190"/>
<od:fieldProperty name="ColumnOrder" type="3" value="0"/>
<od:fieldProperty name="ColumnHidden" type="1" value="0"/>
<od:fieldProperty name="DecimalPlaces" type="2" value="255"/>
<od:fieldProperty name="Required" type="1" value="0"/>
<od:fieldProperty name="DisplayControl" type="3" value="111"/>
<od:fieldProperty name="RowSourceType" type="10" value="Table/Query"/>
<od:fieldProperty name="RowSource" type="12" value="SELECT [80_Persons].[PersonID], [80_Persons].[PersonName] FROM 80_Persons ORDER BY [PersonName]; "/>
<od:fieldProperty name="BoundColumn" type="3" value="1"/>
<od:fieldProperty name="ColumnCount" type="3" value="2"/>
<od:fieldProperty name="ColumnHeads" type="1" value="0"/>
<od:fieldProperty name="ColumnWidths" type="10" value="0;1440"/>
<od:fieldProperty name="ListRows" type="3" value="16"/>
<od:fieldProperty name="ListWidth" type="10" value="1440twip"/>
<od:fieldProperty name="LimitToList" type="1" value="1"/>
<od:fieldProperty name="AllowMultipleValues" type="1" value="0"/>
<od:fieldProperty name="TextAlign" type="2" value="0"/>
<od:fieldProperty name="AllowValueListEdits" type="1" value="1"/>
<od:fieldProperty name="AggregateType" type="4" value="-1"/>
<od:fieldProperty name="ShowOnlyRowSourceValues" type="1" value="0"/>
<od:fieldProperty name="ResultType" type="2" value="0"/>
<od:fieldProperty name="CurrencyLCID" type="4" value="0"/>
<od:fieldProperty name="GUID" type="9" value="WFVVvUePnE6+NOebGEBUgg==
"/>
</xsd:appinfo>
</xsd:annotation>
</xsd:element>
</xsd:sequence>
</xsd:complexType>
</xsd:element>
</xsd:schema>
