<?xml version="1.0" encoding="UTF-8"?>
<dataroot xmlns:od="urn:schemas-microsoft-com:officedata" xmlns:xsi="http://www.w3.org/2001/XMLSchema-instance"  xsi:noNamespaceSchemaLocation="82_AgentPersonMap.xsd" generated="2025-09-22T19:07:51">
<_x0038_2_AgentPersonMap>
<AgentPersonMapID>1</AgentPersonMapID>
<Agent>1</Agent>
<Person>1</Person>
</_x0038_2_AgentPersonMap>
<_x0038_2_AgentPersonMap>
<AgentPersonMapID>2</AgentPersonMapID>
<Agent>1</Agent>
<Person>2</Person>
</_x0038_2_AgentPersonMap>
<_x0038_2_AgentPersonMap>
<AgentPersonMapID>3</AgentPersonMapID>
<Agent>2</Agent>
<Person>1</Person>
</_x0038_2_AgentPersonMap>
<_x0038_2_AgentPersonMap>
<AgentPersonMapID>4</AgentPersonMapID>
<Agent>2</Agent>
<Person>3</Person>
</_x0038_2_AgentPersonMap>
<_x0038_2_AgentPersonMap>
<AgentPersonMapID>5</AgentPersonMapID>
<Agent>3</Agent>
<Person>4</Person>
</_x0038_2_AgentPersonMap>
<_x0038_2_AgentPersonMap>
<AgentPersonMapID>6</AgentPersonMapID>
<Agent>5</Agent>
<Person>5</Person>
</_x0038_2_AgentPersonMap>
<_x0038_2_AgentPersonMap>
<AgentPersonMapID>7</AgentPersonMapID>
<Agent>5</Agent>
<Person>6</Person>
</_x0038_2_AgentPersonMap>
<_x0038_2_AgentPersonMap>
<AgentPersonMapID>8</AgentPersonMapID>
<Agent>5</Agent>
<Person>1</Person>
</_x0038_2_AgentPersonMap>
<_x0038_2_AgentPersonMap>
<AgentPersonMapID>9</AgentPersonMapID>
<Agent>5</Agent>
<Person>7</Person>
</_x0038_2_AgentPersonMap>
<_x0038_2_AgentPersonMap>
<AgentPersonMapID>10</AgentPersonMapID>
<Agent>5</Agent>
<Person>8</Person>
</_x0038_2_AgentPersonMap>
<_x0038_2_AgentPersonMap>
<AgentPersonMapID>11</AgentPersonMapID>
<Agent>5</Agent>
<Person>9</Person>
</_x0038_2_AgentPersonMap>
<_x0038_2_AgentPersonMap>
<AgentPersonMapID>12</AgentPersonMapID>
<Agent>5</Agent>
<Person>10</Person>
</_x0038_2_AgentPersonMap>
<_x0038_2_AgentPersonMap>
<AgentPersonMapID>13</AgentPersonMapID>
<Agent>5</Agent>
<Person>11</Person>
</_x0038_2_AgentPersonMap>
<_x0038_2_AgentPersonMap>
<AgentPersonMapID>14</AgentPersonMapID>
<Agent>6</Agent>
<Person>5</Person>
</_x0038_2_AgentPersonMap>
<_x0038_2_AgentPersonMap>
<AgentPersonMapID>15</AgentPersonMapID>
<Agent>6</Agent>
<Person>13</Person>
</_x0038_2_AgentPersonMap>
<_x0038_2_AgentPersonMap>
<AgentPersonMapID>16</AgentPersonMapID>
<Agent>6</Agent>
<Person>12</Person>
</_x0038_2_AgentPersonMap>
<_x0038_2_AgentPersonMap>
<AgentPersonMapID>17</AgentPersonMapID>
<Agent>6</Agent>
<Person>1</Person>
</_x0038_2_AgentPersonMap>
<_x0038_2_AgentPersonMap>
<AgentPersonMapID>18</AgentPersonMapID>
<Agent>6</Agent>
<Person>11</Person>
</_x0038_2_AgentPersonMap>
<_x0038_2_AgentPersonMap>
<AgentPersonMapID>19</AgentPersonMapID>
<Agent>3</Agent>
<Person>1</Person>
</_x0038_2_AgentPersonMap>
<_x0038_2_AgentPersonMap>
<AgentPersonMapID>20</AgentPersonMapID>
<Agent>3</Agent>
<Person>3</Person>
</_x0038_2_AgentPersonMap>
<_x0038_2_AgentPersonMap>
<AgentPersonMapID>21</AgentPersonMapID>
<Agent>7</Agent>
<Person>1</Person>
</_x0038_2_AgentPersonMap>
<_x0038_2_AgentPersonMap>
<AgentPersonMapID>22</AgentPersonMapID>
<Agent>7</Agent>
<Person>15</Person>
</_x0038_2_AgentPersonMap>
<_x0038_2_AgentPersonMap>
<AgentPersonMapID>23</AgentPersonMapID>
<Agent>8</Agent>
<Person>14</Person>
</_x0038_2_AgentPersonMap>
<_x0038_2_AgentPersonMap>
<AgentPersonMapID>24</AgentPersonMapID>
<Agent>8</Agent>
<Person>5</Person>
</_x0038_2_AgentPersonMap>
<_x0038_2_AgentPersonMap>
<AgentPersonMapID>26</AgentPersonMapID>
<Agent>8</Agent>
<Person>1</Person>
</_x0038_2_AgentPersonMap>
<_x0038_2_AgentPersonMap>
<AgentPersonMapID>27</AgentPersonMapID>
<Agent>8</Agent>
<Person>17</Person>
</_x0038_2_AgentPersonMap>
<_x0038_2_AgentPersonMap>
<AgentPersonMapID>28</AgentPersonMapID>
<Agent>8</Agent>
<Person>18</Person>
</_x0038_2_AgentPersonMap>
<_x0038_2_AgentPersonMap>
<AgentPersonMapID>29</AgentPersonMapID>
<Agent>8</Agent>
<Person>19</Person>
</_x0038_2_AgentPersonMap>
<_x0038_2_AgentPersonMap>
<AgentPersonMapID>30</AgentPersonMapID>
<Agent>9</Agent>
<Person>20</Person>
</_x0038_2_AgentPersonMap>
<_x0038_2_AgentPersonMap>
<AgentPersonMapID>31</AgentPersonMapID>
<Agent>10</Agent>
<Person>21</Person>
</_x0038_2_AgentPersonMap>
<_x0038_2_AgentPersonMap>
<AgentPersonMapID>32</AgentPersonMapID>
<Agent>13</Agent>
<Person>24</Person>
</_x0038_2_AgentPersonMap>
<_x0038_2_AgentPersonMap>
<AgentPersonMapID>33</AgentPersonMapID>
<Agent>13</Agent>
<Person>25</Person>
</_x0038_2_AgentPersonMap>
<_x0038_2_AgentPersonMap>
<AgentPersonMapID>34</AgentPersonMapID>
<Agent>14</Agent>
<Person>5</Person>
</_x0038_2_AgentPersonMap>
<_x0038_2_AgentPersonMap>
<AgentPersonMapID>35</AgentPersonMapID>
<Agent>14</Agent>
<Person>26</Person>
</_x0038_2_AgentPersonMap>
<_x0038_2_AgentPersonMap>
<AgentPersonMapID>36</AgentPersonMapID>
<Agent>14</Agent>
<Person>12</Person>
</_x0038_2_AgentPersonMap>
<_x0038_2_AgentPersonMap>
<AgentPersonMapID>37</AgentPersonMapID>
<Agent>14</Agent>
<Person>10</Person>
</_x0038_2_AgentPersonMap>
<_x0038_2_AgentPersonMap>
<AgentPersonMapID>38</AgentPersonMapID>
<Agent>14</Agent>
<Person>1</Person>
</_x0038_2_AgentPersonMap>
<_x0038_2_AgentPersonMap>
<AgentPersonMapID>39</AgentPersonMapID>
<Agent>15</Agent>
<Person>29</Person>
</_x0038_2_AgentPersonMap>
<_x0038_2_AgentPersonMap>
<AgentPersonMapID>40</AgentPersonMapID>
<Agent>15</Agent>
<Person>30</Person>
</_x0038_2_AgentPersonMap>
<_x0038_2_AgentPersonMap>
<AgentPersonMapID>41</AgentPersonMapID>
<Agent>15</Agent>
<Person>31</Person>
</_x0038_2_AgentPersonMap>
<_x0038_2_AgentPersonMap>
<AgentPersonMapID>42</AgentPersonMapID>
<Agent>15</Agent>
<Person>32</Person>
</_x0038_2_AgentPersonMap>
<_x0038_2_AgentPersonMap>
<AgentPersonMapID>43</AgentPersonMapID>
<Agent>15</Agent>
<Person>1</Person>
</_x0038_2_AgentPersonMap>
<_x0038_2_AgentPersonMap>
<AgentPersonMapID>44</AgentPersonMapID>
<Agent>15</Agent>
<Person>33</Person>
</_x0038_2_AgentPersonMap>
<_x0038_2_AgentPersonMap>
<AgentPersonMapID>45</AgentPersonMapID>
<Agent>16</Agent>
<Person>29</Person>
</_x0038_2_AgentPersonMap>
<_x0038_2_AgentPersonMap>
<AgentPersonMapID>46</AgentPersonMapID>
<Agent>16</Agent>
<Person>30</Person>
</_x0038_2_AgentPersonMap>
<_x0038_2_AgentPersonMap>
<AgentPersonMapID>47</AgentPersonMapID>
<Agent>16</Agent>
<Person>31</Person>
</_x0038_2_AgentPersonMap>
<_x0038_2_AgentPersonMap>
<AgentPersonMapID>48</AgentPersonMapID>
<Agent>16</Agent>
<Person>32</Person>
</_x0038_2_AgentPersonMap>
<_x0038_2_AgentPersonMap>
<AgentPersonMapID>49</AgentPersonMapID>
<Agent>16</Agent>
<Person>1</Person>
</_x0038_2_AgentPersonMap>
<_x0038_2_AgentPersonMap>
<AgentPersonMapID>50</AgentPersonMapID>
<Agent>16</Agent>
<Person>33</Person>
</_x0038_2_AgentPersonMap>
<_x0038_2_AgentPersonMap>
<AgentPersonMapID>51</AgentPersonMapID>
<Agent>16</Agent>
<Person>15</Person>
</_x0038_2_AgentPersonMap>
<_x0038_2_AgentPersonMap>
<AgentPersonMapID>52</AgentPersonMapID>
<Agent>17</Agent>
<Person>29</Person>
</_x0038_2_AgentPersonMap>
<_x0038_2_AgentPersonMap>
<AgentPersonMapID>53</AgentPersonMapID>
<Agent>17</Agent>
<Person>30</Person>
</_x0038_2_AgentPersonMap>
<_x0038_2_AgentPersonMap>
<AgentPersonMapID>54</AgentPersonMapID>
<Agent>17</Agent>
<Person>31</Person>
</_x0038_2_AgentPersonMap>
<_x0038_2_AgentPersonMap>
<AgentPersonMapID>55</AgentPersonMapID>
<Agent>17</Agent>
<Person>32</Person>
</_x0038_2_AgentPersonMap>
<_x0038_2_AgentPersonMap>
<AgentPersonMapID>56</AgentPersonMapID>
<Agent>17</Agent>
<Person>1</Person>
</_x0038_2_AgentPersonMap>
<_x0038_2_AgentPersonMap>
<AgentPersonMapID>57</AgentPersonMapID>
<Agent>17</Agent>
<Person>33</Person>
</_x0038_2_AgentPersonMap>
<_x0038_2_AgentPersonMap>
<AgentPersonMapID>58</AgentPersonMapID>
<Agent>17</Agent>
<Person>15</Person>
</_x0038_2_AgentPersonMap>
<_x0038_2_AgentPersonMap>
<AgentPersonMapID>59</AgentPersonMapID>
<Agent>17</Agent>
<Person>1</Person>
</_x0038_2_AgentPersonMap>
<_x0038_2_AgentPersonMap>
<AgentPersonMapID>60</AgentPersonMapID>
<Agent>12</Agent>
<Person>22</Person>
</_x0038_2_AgentPersonMap>
<_x0038_2_AgentPersonMap>
<AgentPersonMapID>61</AgentPersonMapID>
<Agent>12</Agent>
<Person>23</Person>
</_x0038_2_AgentPersonMap>
<_x0038_2_AgentPersonMap>
<AgentPersonMapID>62</AgentPersonMapID>
<Agent>18</Agent>
<Person>9</Person>
</_x0038_2_AgentPersonMap>
<_x0038_2_AgentPersonMap>
<AgentPersonMapID>63</AgentPersonMapID>
<Agent>18</Agent>
<Person>37</Person>
</_x0038_2_AgentPersonMap>
<_x0038_2_AgentPersonMap>
<AgentPersonMapID>64</AgentPersonMapID>
<Agent>18</Agent>
<Person>38</Person>
</_x0038_2_AgentPersonMap>
<_x0038_2_AgentPersonMap>
<AgentPersonMapID>65</AgentPersonMapID>
<Agent>18</Agent>
<Person>39</Person>
</_x0038_2_AgentPersonMap>
<_x0038_2_AgentPersonMap>
<AgentPersonMapID>66</AgentPersonMapID>
<Agent>18</Agent>
<Person>1</Person>
</_x0038_2_AgentPersonMap>
<_x0038_2_AgentPersonMap>
<AgentPersonMapID>67</AgentPersonMapID>
<Agent>19</Agent>
<Person>17</Person>
</_x0038_2_AgentPersonMap>
<_x0038_2_AgentPersonMap>
<AgentPersonMapID>68</AgentPersonMapID>
<Agent>19</Agent>
<Person>18</Person>
</_x0038_2_AgentPersonMap>
<_x0038_2_AgentPersonMap>
<AgentPersonMapID>69</AgentPersonMapID>
<Agent>19</Agent>
<Person>1</Person>
</_x0038_2_AgentPersonMap>
<_x0038_2_AgentPersonMap>
<AgentPersonMapID>70</AgentPersonMapID>
<Agent>15</Agent>
<Person>41</Person>
</_x0038_2_AgentPersonMap>
<_x0038_2_AgentPersonMap>
<AgentPersonMapID>71</AgentPersonMapID>
<Agent>15</Agent>
<Person>40</Person>
</_x0038_2_AgentPersonMap>
<_x0038_2_AgentPersonMap>
<AgentPersonMapID>72</AgentPersonMapID>
<Agent>20</Agent>
<Person>42</Person>
</_x0038_2_AgentPersonMap>
<_x0038_2_AgentPersonMap>
<AgentPersonMapID>73</AgentPersonMapID>
<Agent>20</Agent>
<Person>43</Person>
</_x0038_2_AgentPersonMap>
<_x0038_2_AgentPersonMap>